Title,Article Link,Date,Day,Month,Year,Article,Location
Ahmedabad saw a rise in vehicular accident emergency cases in Navratri,https://english.gujaratsamachar.com/news/gujarat/ahmedabad-saw-a-rise-in-vehicular-accident-emergency-cases-in-navratri,2024-10-15,15,10,2024,"During the nine days of Navratri, Trauma (vehicular) accidents (trauma caused due to the road accidents) surged compared to regular days. Data from 108 EMRI services shows a 15.67% increase in vehicle-related injuries, with 837 accidents recorded during the Navratri period in Ahmedabad, where on an average daily reported cases of accidents were around 90. In Gujarat, on normal days, 423 vehicular trauma cases were registered, but the number rose to 499 during the festive period, recording a staggering rise of 18.04%. In Ahmedabad, a total of 8,437 emergency cases were logged over the nine days of Navratri. This included health emergencies like abdominal pain, breathing issues which slightly rose compared to normal days, high fever, cardiac attacks, and strokes resulting in a total of 41,339 emergency cases across the state. To address the rising number of accidents, Ahmedabad City Police had deployed additional traffic officers at night. However, despite these measures, the state saw a rise in the number of accidents. This came after statements from Home Minister Harsh Sangahavi who permitted ‘Khelayias’ to play garba till 5 am. With the rise in vehicular accidents, the festival also saw alarming incidents of violence and crime, including a stabbing of a 16-year-old boy in Thaltej and reports of gang-rape of minors in the state, which raised questions about the security of citizens. Also read : Gujarat sees at least 35 stroke-related emergencies in a month Faced with an emergency in public in Ahmedabad? Turn to the emergency call box",ahmedabad
Questions arise over gangster Lawrence Bishnoi calling the shots from Sabarmati jail,https://english.gujaratsamachar.com/news/gujarat/questions-arise-over-gangster-lawrence-bishnoi-calling-the-shots-from-sabarmati-jail,2024-10-15,15,10,2024,"The Lawrence Bishnoi gang recently claimed responsibility for the murder of NCP leader Baba Siddique in Mumbai. However, Lawrence has been locked up in Ahmedabad’s Sabarmati Central Jail for over two years. A natural question that arises among people is that despite being confined to the high-security cell, how did Bishnoi carry out the murder of a high-profile leader like Siddique? Bishnoi is prohibited from being transferred out of Sabarmati Jail under CRPC 298. But his name crops up in three incidents: recce of Salman Khan’s house, threatening messages to Salman and Mumbai Police mentioning that the shooters involved in Siddique’s murder are part of Lawrence Bishnoi’s gang. Moreover, it has been said that he has created a hitlist of the next targets. So, how does he manage to convey the messages to the hitmen and how do they get the guns and the money to carry out the killing? These questions beg answers. The Mumbai Police is yet to visit Sabarmati jail to question Bishnoi. In August this year, the Ministry of Home Affairs had extended for another year the restrictions placed on the movement of Bishnoi. So, questioning of Bishnoi can take place only within Sabarmati jail and he cannot be taken outside. Back-to-back Bishnoi attacks The gang also hit the headlines this June when Hindi cinema superstar  Salman Khan was threatened. The Bishnoi gang claimed responsibility after shots were fired in the direction of Khan’s residence, Galaxy Apartment. The notorious gang also claimed responsibility for firing incidents outside the residences of singers AP Dhillon and Gippy Grewal in Vancouver in November 2023. Similarly, the gang also claimed responsibility for the murder of Karni Sena chief Sukhdev Singh Gogamedi and popular singer Siddhu Moosewala. Who is Lawrence Bishnoi? Born in Dhattaranwali village in Punjab’s Ferozepur district, the son of a police constable, Lawrence Bishnoi stepped into the world of crimes during his studies at Punjab University. The 31-year-old was involved in politics and was president of the Student Organisation of Panjab University (SOPU) in 2011-2012. According to reports, Bishnoi has an army of 700 members including shooters and gangsters such as Goldy Brar, Sachin Thapan, Anmol Bishnoi, etc. Also read: Baba Siddique murder: Shooters claim Lawrence Bishnoi gang link, say sources",ahmedabad
DEO penalises two East Ahmedabad schools for violating guidelines,https://english.gujaratsamachar.com/news/gujarat/deo-penalises-two-east-ahmedabad-schools-for-violating-guidelines,2024-10-15,15,10,2024,"The Ahmedabad District Education Officer (DEO) has issued notices to several schools after they were found to violate guidelines during a recent survey. The DEO issued notice to The School of Achievers for conducting classes in a basement, where exposed electric wires were a risk to safety of students. Upon noticing this during an inspection, the DEO instructed the school to take effective measures to address the issue and imposed a fine of ₹10,000. After the school failed to pay the fine for a long period, the amount was increased to ₹25,000, and a new notice was issued. Additionally, the DEO issued a notice to Nelson School in Maninagar after books from a private publication were found at the school. The DEO had sought an explanation from the school over the use of private publication books. After the school’s explanation was found to be unsatisfactory, a fine of ₹10,000 was imposed on the school. Also read : Ahmedabad DEO cracks down on school students driving without licence A’bad schools outsourcing academics to coaching institutes",ahmedabad
Over ₹79 lakh scam uncovered by Ahmedabad cyber crime branch,https://english.gujaratsamachar.com/news/gujarat/overrs-79-lakh-uncovered-by-cyber-crime-branch-in-ahmedabad,2024-10-15,15,10,2024,"The Cyber Crime Branch of Ahmedabad in Gujarat busted an international gang involved in a ₹79,34,639 fraud case where the accused posed as officials from TRAI, Mumbai Cyber Crime, and the CBI, an official said. Officials informed that the gang tricked a local resident by falsely claiming that their mobile phone was involved in illegal activities. The scammers further stated that a complaint had been filed against the individual at the Byculla police station in Mumbai. They used this claim to defraud the victim under the pretence of RBI verification. The gang convinced the complainant that their mobile number was linked to illegal activities, such as prohibited advertising, and that their bank account had suspicious transactions linked to their Aadhaar card. Using intimidation tactics, including threats of an arrest warrant, the criminals continuously monitored the complainant through WhatsApp calls. They pressured the victim to transfer ₹79,34,639 to a bank account under the guise of verification, promising to refund the money after the process was complete. A joint operation by the Cyber Crime Branch in Delhi and Bengaluru led to the arrest of two Taiwanese nationals, Mu Chi Sang and Chang Hao Yun (also known as Mark), who were key players in the scam. The police also arrested two more Taiwanese nationals in Bengaluru. A total of four foreign nationals were detained for their role in this elaborate fraud. The investigation revealed a sophisticated modus operandi involving 20 rooted mobile phones connected to routers, which intercepted OTPs from victims’ bank accounts. Over 120 mobile devices were linked to this setup, with operations spread across Delhi, Bengaluru, and Mumbai. The gang was using rented bank accounts in exchange for commissions, provided by locals in Gujarat, Rajasthan, Delhi, and Odisha, eight of whom were arrested during the raids. Raids in Mumbai and Delhi also led to the arrest of Saif Haider, who was in direct contact with Mark, the Taiwanese mastermind. Mark was responsible for providing rooted mobile phones and routers and bringing equipment from Taiwan to set up illegal operations. He had travelled to multiple countries, including Cambodia, Dubai, China, and several cities in India, such as Bengaluru, Delhi, and Mumbai, to expand the fraudulent activities. During their recent trip to India on October 10, Mark and his associate Marco were attempting to expand their network by collecting rented bank accounts from Indian agents to use for illegal betting and cyber fraud. Two more Taiwanese nationals, Wang Chun Wei (aka Sumoka) and Shen Wei Hao (aka Krish), were arrested in Bengaluru. They were found to be operating a similar setup and were in contact with Saif Haider and other gang members. The cyber police seized ₹12.75 lakh in cash, 761 SIM cards, 120 mobile phones, 96 cheque books, 92 debit and credit cards, 48 cheques, 42 passbooks, 32 USB charging hubs, and other technical equipment, including minicomputers and routers. The gang used rooted mobile phones to intercept OTPs and access bank accounts for illegal activities, including cyber fraud, gaming, betting, and money laundering. This international gang’s operations were vast, with connections across multiple states, including Gujarat, Maharashtra, Odisha, Delhi, and Karnataka. The Cyber Crime Branch’s investigation continues, with efforts underway to apprehend more members involved in this elaborate scam. (This story was taken from a syndicated feed and was only edited for style by Gujarat Samachar Digital staff) Also read: Ahmedabad's octogenarian scammed of ₹19.10 lakh in cyber fraud",ahmedabad
Ahmedabad citizens leave without solutions from Municipal Seva Setu Programme,https://english.gujaratsamachar.com/news/gujarat/ahmedabad-citizens-leave-without-solutions-from-municipal-seva-setu-programme,2024-10-16,16,10,2024,"A Seva Setu programme was organised by the Amdavad Municipal Corporation at Khandubhai Desai Hall in Asarwa.The programme is held to deliver citizen-centric services at village level by minimising the need for citizens to visit taluka/ district centres. Despite a provision for AC in the hall, a dozen air coolers were brought by the municipal authorities for the event. The community hall also lacked a microphone system, which was needed during the event. When this issue was brought before Mayor Pratibha Jain, she reprimanded the Deputy Municipal Commissioner of the  central zone, Ramya Bhatt, who then apologised for the oversight. The microphone system was set up after the mayor’s intervention. Additionally, the assistant municipal commissioner for the Shahibaug ward, Sagar Piluchiya, was served a notice seeking a clarification regarding the event’s organisation. Some tables at the programme were set up without any staff present, leaving applicants confused. There was no clear indication as to whom to approach for birth certificate updates. Several people struggled to decipher the boards on the tables like RBD and such, which left them confused. People were unable to understand the English and the short abbreviated words. Many applicants left disappointed due to a lack of responses and assistance. Notably, no notary was present at the designated table for document verification until 11.30 am. While the Mayor, Deputy Mayor, Standing Committee Chairperson, and all MLAs from East Ahmedabad were present, most BJP councillors  were absent. Only four councillors from Asarwa attended. Within half-an-hour after the programme concluded, all corporators, along with municipal officials, left the venue. Congress MLAs from Khadiya-Jamalpur and Dani Limda were also absent. Also read : Khadia ward inspector quits voluntarily after AMC councillors trouble him Suspended AMC engineer booked over 171% disproportionate assets",ahmedabad
LLB aspirants of Gujarat struggle between State and BCI over admissions,https://english.gujaratsamachar.com/news/gujarat/llb-aspirants-of-gujarat-struggle-between-state-and-bci-over-admissions,2024-10-16,16,10,2024,"Law students in Gujarat have been awaiting admissions to the Bachelor of Legislative Law (LLB) in grant-in-aid colleges of the state over pending approvals from the Bar Council of India (BCI) and the state government’s lack of clarity with grant amount. Hearing a writ petition over the stalled admissions, a bench led by Justice Pranav Trivedi took a serious note of the issue, and summoned the Advocate  General of the state. Around 28 grant-in-aid colleges of Gujarat await grants from the government. The state government offers grants only to one class, considering 120 students per class. However, the BCI only allows 60 students per class. So, the colleges fail to get grants for the second class. Since the BCI approvals are pending with many institutions, the students are awaiting their turn for admission. The fees in granted colleges range from ₹1,000-₹1,500, whereas private colleges charge ₹1.5 lakh to 2 lakh per student. Yet, the granted colleges were fined ₹15 lakh to 20 lakh by the BCI. Students have demanded that the state government approve the necessary teaching staff and infrastructure in accordance with BCI regulations for grant-in-aid colleges, and  not take any action against such colleges till all the facilities are provided. Taking the serious note of the concerns and appeal of the students, the Gujarat High Court has asked the State Advocate General to be present in the next hearing. Also read : Over thousand applications pending for Bar Council recognition, students suffer Law students to go through criminal background check, legal system strengthened",ahmedabad
Taiwanese gang busted in Ahmedabad transferred ₹500 cr out of India,https://english.gujaratsamachar.com/news/gujarat/taiwanese-nationals-busted-in-ahmedabad-transferred-rs-500-cr-out-of-india,2024-10-16,16,10,2024,"A Taiwanese gang that was arrested in Ahmedabad on Sunday allegedly transferred ₹500 crore abroad in one year through thousands of bank accounts. A joint operation by the Cyber Crime branch in Delhi and Bengaluru led to the arrest of two Taiwanese nationals, Mu Chi Sang and Chang Hao Yun (also known as Mark), who were key players in the scam. Later, two more members were also arrested. The gang was active in India, Taiwan, Cambodia, Vietnam, Maldives, and Dubai. According to reports, their modus operandi included appointing technical staff in Vadodara, Bengaluru, Mumbai, and Delhi and operating the racket through call centres. As per the Ahmedabad Cyber Crime branch, 450 complaints have been registered against the Taiwanese gang nationwide. They allegedly defrauded victims of ₹5 crore daily. The gang had tricked a senior citizen in Ahmedabad by falsely claiming that their mobile phone was involved in illegal activities. They pressured the victim to transfer ₹79.34 lakh to a bank account under the guise of verification, promising to refund the money after the process was complete. The investigation revealed a sophisticated modus operandi involving 20 rooted mobile phones connected to routers, which intercepted OTPs from victims’ bank accounts. Over 120 mobile devices were linked to this setup, with operations spread across Delhi, Bengaluru, and Mumbai. The gang was using rented bank accounts in exchange for commissions, provided by locals in Gujarat, Rajasthan, Delhi, and Odisha, eight of whom were arrested during the raids. According to reports, there are more such gangs who scam people with the same modus operandi. The issue cannot be resolved until the dummy accounts, on rent for ₹5,000 to ₹25,000 per month, continue to exist. Another practice fuelling the fire of such scams is the issuance of SIM cards under dummy names for mere ₹200-500. Also read: Ahmedabad's octogenarian scammed of ₹19.10 lakh in cyber fraud UP gang stole ₹2 cr from A’bad company owner‘s bank account",ahmedabad
Spine-related problems due to stress on rise in Ahmedabad,https://english.gujaratsamachar.com/news/health/spine-related-problems-due-to-stress-on-rise-in-ahmedabad,2024-10-16,16,10,2024,"The 2024 theme, ‘Support your Spine’ on the World Spine Day website urges individuals to “spread awareness about the worldwide impact of spinal pain and disability” and “aims to empower people of all ages, across all nations to adopt evidence-based strategies for maintaining spinal health”. After Covid-19, a shift in health problems was observed. Earlier, spinal cord pain was primarily seen in individuals aged 50 or older, but there has been a notable increase in spinal issues among young people aged 25 and above . Experts from the Spine Institute at Ahmedabad’s Sola Civil Hospital note that two decades ago, most patients with spine-related problems were over the age of 50. But now patients in their 30s and 40s are reporting such issues. About spine-related issues in Ahmedabad, it has been observed that stress plays a crucial role in spinal injuries and related conditions. Stress can lead to what is known as ‘psychosomatic pain’, where the pain in the spine is caused due to excessive stress. Moreover, a sedentary lifestyle and poor posture– such as working on a laptop while lying down – contribute to spinal pain. Additionally, driving a 2-wheeler vehicle for a long period can be a factor in developing spine-related problems. Furthermore, children carrying heavy school bags are also increasingly reporting spinal pain. Also read : Why understanding and improving mental health at workplace is important Unable to sleep properly? Blame PFAs in your blood",ahmedabad
"Congress MLA, IPS officer involved in verbal spat at Police HQ in Ahmedabad",https://english.gujaratsamachar.com/news/gujarat/congress-mla-ips-officer-involved-in-verbal-spat-at-police-hq-in-ahmedabad,2024-10-16,16,10,2024,"Jignesh Mevani Congress MLA Jignesh Mevani and Additional DG Rajkumar Pandian were involved in a verbal altercation during the former’s visit to the Police Bhavan. To address the concerns of Dalit community, Vadgam MLA Jignesh Mevani and Congress’ scheduled caste department chairman Hitesh Pithadia had gone to meet Additional Director General (ADG) Rajkumar Pandian on Tuesday at 12.30 pm. The confrontation began when ADG Pandian asked the MLA and Pithadia to leave their phones outside the office. Mevani, in response, sought to know if the government had issued any notice or circular regarding phones, as phones are allowed in most government offices. This led to a heated argument between the MLA and the ADG. Mevani said that misbehaviour of police with top elected members of the state is unacceptable, and alleged that the police are not interested in listening to the issues of Dalits. “If the issues of Dalits are not heard, a petition will be filed in the high court,” he said. Mevani further alleged that IPS Pandian told him that the MLA was breaking the protocol by wearing a t-shirt to a government office,. This is disrespectful for an MLA. After the incident, Mevani filed a written application and called for a detailed investigation against the IPS. On the other hand, Home Secretary Manoj Das had said that he has not received any written application in this matter. Pandian in his statement said that Mevani had visited the office to discuss about the situation in Kutch, and the IPS was all ears, however, the dispute has diverted the issue. Also read : Cong MLA Jignesh Mevani directed to leave Gujarat Assembly during debate Congress MLA Jignesh Mevani, 30 others acquitted in 2017 Guj train obstruction case Gujarat Congress launches ‘Nyay Yatra’ from Morbi for tragedy affected families",ahmedabad
"₹8,000 cr drugs seized in Gujarat in 1 year: Is dry state new narco haven?",https://english.gujaratsamachar.com/news/gujarat/rs-8000-cr-drugs-seized-in-gujarat-in-1-year-is-dry-state-new-narco-haven,2024-10-16,16,10,2024,"Over the past year, drugs worth more than ₹8,000 crore have been either seized in Gujarat, or traced back to the state after being seized elsewhere. Drug seizures in Gujarat over the last five years have yielded a total of 93,691 kg — 2,229 litres of liquid drugs, and 73,163 pills and injections — of narcotics. Before the modus operandi of making drugs under the guise of pharmaceutical companies, the only trend was smuggling drugs via Pakistan and Afghanistan in Gujarat. Units manufacturing drugs were spread across Rajasthan, Maharashtra, and Madhya Pradesh. Now, drug manufacturers seem to be taking advantage of Gujarat’s position as a top pharma hub to set up operations within the state. Central and state agencies have conducted several major anti-narcotics operations in Gujarat this year alone. October: Directorate of Revenue Intelligence (DRI) and Narcotics Cell of the Criminal Investigation Department (CID) bust a mephedrone factory in Valsad’s Umargam GIDC and Dehari. The joint operation leads to three arrests and a seizure of 17 kg of liquid mephedrone worth ₹25 crore. An investigation into ₹7,000 crore worth of cocaine seized by the Delhi Police is revealed to have been manufactured in Ankleshwar ; raid at the drug unit leads to seizure of 518 kg of cocaine, worth ₹5,000 crore. August: The Anti-Terrorist Squad (ATS) of the Gujarat Police seizes ₹800 crore worth of drugs from a Thane factory. July: Mephedrone worth ₹51 crore seized in Palsana factory bust. Customs seizes a container carrying 68 lakh tramadol tablets (worth ₹110 crore), intended for delivery to West Africa, from the Mundra port in Kutch. ATS team busts unit illegally making tramadol at a pharma unit in Dahej’s Jolva GIDC ; seizes 1,410 litres of liquid tramadol — which is used in the production of tramadol tablets — worth ₹31 crore. June: Joint operation between ATS and Narcotics Control Bureau (NCB) in Madhya Pradesh leads to the seizure of 907 kg of mephedrone, worth ₹1,814 crore from a factory in the Bagroda Industrial Area near Bhopal. April: ATS-NCB raids in Gandhinagar's Piplaj, Bhaktinagar in Amreli, Sirohi in Rajasthan, and Osian in Rajasthan lead to seizure of ₹230 crore worth of mephedrone, 13 arrests. With Gujarat’s pharma boom bringing in increased investment and competition, law enforcement authorities will be looking to combat rising illicit drug activities while also continuing to keep one eye out to sea. Also read: DRI nabs four with drugs worth ₹168 cr in Gujarat’s border district",ahmedabad
Gujarat High Court questions role of police in cases of money recovery,https://english.gujaratsamachar.com/news/gujarat/gujarat-high-court-questions-role-of-police-in-cases-of-money-recovery,2024-10-16,16,10,2024,"Gujarat High Court addressed concerns of police involvement in matters of lending and repayment, while hearing a civil matter involving an agro businessman from Jetpur. The businessman had filed a writ petition against the police, alleging harassment over a demand to repay ₹21 lakh. He claimed that senior officers, including the deputy commissioner of police (DCP) and a police inspector (PI), had repeatedly contacted him, issuing threats and summons, asking for a repayment to a complainant. During the proceedings, Justice Sandip Bhatt criticised the police’s focus on the recovery of funds, questioning their work, such as traffic congestion on the Bavla-Changodar road. “What is going on? Are the police only interested in money recovery? There are a lot of traffic problems that need addressing in the city,” the Justice remarked. Justice Bhatt said that the situation was a business matter, and questioned why the police were interested so much in this matter. “Is this what police are meant for? This is too much,” he stated. Further criticising the police, the court observed that even though the role of police is to help people, these days, safety of women and ordinary citizens has become a concern. People are pulling out swords in small disputes, and police are misusing their powers. Rather than focusing on money recovery, police should control law and order situation in the state, said the Justice. The high court also demanded clarity on the basis of which the notice was issued in this civil dispute. The court has ordered top officials to provide detailed reports and explanations in the next hearing,  scheduled on October 25. Also read : Gujarat High Court take state govt to task for helmet rule violations during festive season Gujarat High Court directs court officials, staff to mandatory wear helmets",ahmedabad
